{
  "rfa_id": "NSF-26-508",
  "rfa_number": "26-508",
  "rfa_title": "TechAccess: AI-Ready America \u2014 State/Territory Coordination Hubs",
  "sponsor_name": "National Science Foundation",
  "program_code": null,
  "announcement_url": "https://www.nsf.gov/pubs/2026/nsf26508/nsf26508.htm",
  "opportunity_number": "26-508",
  "cfda_number": "17.280, 47.070, 47.076, 47.084, 59.037",
  "announcement_date": "2026-03-25",
  "submission_deadline": "2027-07-01",
  "loi_deadline": "2027-06-01",
  "preproposal_deadline": null,
  "funding_floor": null,
  "funding_ceiling": 3000000,
  "expected_awards": 56,
  "max_duration_months": 36,
  "submission_method": "Research.gov or Grants.gov",
  "rfa_status": "Active",
  "required_documents": [
    {
      "label": "Cover Sheet",
      "code": "COVER_SHEET",
      "description": "Standard cover sheet completed per PAPPG.",
      "page_limit": null,
      "format_spec": null,
      "is_required": true,
      "source_section": "PAPPG Chapter II.D.2",
      "structured_rule_type": null,
      "structured_rule_value": null
    },
    {
      "label": "Project Summary",
      "code": "PROJECT_SUMMARY",
      "description": "One-page summary with separate sections for Overview, Intellectual Merit, and Broader Impacts.",
      "page_limit": 1,
      "format_spec": null,
      "is_required": true,
      "source_section": "PAPPG Chapter II.D.2",
      "structured_rule_type": null,
      "structured_rule_value": null
    },
    {
      "label": "Table of Contents",
      "code": "TABLE_OF_CONTENTS",
      "description": "Auto-generated by the submission system.",
      "page_limit": null,
      "format_spec": null,
      "is_required": true,
      "source_section": "PAPPG Chapter II.D.2",
      "structured_rule_type": null,
      "structured_rule_value": null
    },
    {
      "label": "Project Description",
      "code": "PROJECT_DESCRIPTION",
      "description": "Full narrative; 15-page limit; references cited not counted; must use the five mandated Section 1\u20135 headers verbatim or the proposal will be Returned Without Review.",
      "page_limit": 15,
      "format_spec": null,
      "is_required": true,
      "source_section": "NSF 26-508 Section V; PAPPG Chapter II.D.2",
      "structured_rule_type": null,
      "structured_rule_value": null
    },
    {
      "label": "References Cited",
      "code": "REFERENCES_CITED",
      "description": "Not counted against the 15-page Project Description limit.",
      "page_limit": null,
      "format_spec": null,
      "is_required": true,
      "source_section": "PAPPG Chapter II.D.2",
      "structured_rule_type": null,
      "structured_rule_value": null
    },
    {
      "label": "Biographical Sketch",
      "code": "BIOGRAPHICAL_SKETCH",
      "description": "For PI, Co-PIs, and Senior Personnel; prepared per PAPPG format.",
      "page_limit": null,
      "format_spec": null,
      "is_required": true,
      "source_section": "PAPPG Chapter II.D.2",
      "structured_rule_type": null,
      "structured_rule_value": null
    },
    {
      "label": "Budget and Budget Justification",
      "code": "BUDGET_AND_JUSTIFICATION",
      "description": "NSF-format budget with narrative justification.",
      "page_limit": null,
      "format_spec": null,
      "is_required": true,
      "source_section": "PAPPG Chapter II.D.2",
      "structured_rule_type": null,
      "structured_rule_value": null
    },
    {
      "label": "Current and Pending (Other) Support",
      "code": "CURRENT_AND_PENDING",
      "description": "For PI, Co-PIs, and Senior Personnel; prepared per PAPPG format.",
      "page_limit": null,
      "format_spec": null,
      "is_required": true,
      "source_section": "PAPPG Chapter II.D.2",
      "structured_rule_type": null,
      "structured_rule_value": null
    },
    {
      "label": "Facilities, Equipment, and Other Resources",
      "code": "FACILITIES_EQUIPMENT_RESOURCES",
      "description": "Prepared per PAPPG format.",
      "page_limit": null,
      "format_spec": null,
      "is_required": true,
      "source_section": "PAPPG Chapter II.D.2",
      "structured_rule_type": null,
      "structured_rule_value": null
    },
    {
      "label": "Data Management Plan",
      "code": "DATA_MANAGEMENT_PLAN",
      "description": "Consistent with PAPPG requirements. Program-specific data collection and reporting are required.",
      "page_limit": null,
      "format_spec": null,
      "is_required": true,
      "source_section": "NSF 26-508 Section V.A; PAPPG Chapter II.D.2",
      "structured_rule_type": "dmp_required",
      "structured_rule_value": "yes"
    },
    {
      "label": "Letters of Collaboration",
      "code": "LETTERS_OF_COLLABORATION",
      "description": "One letter from every partner identified in the proposal, following the PAPPG format.",
      "page_limit": null,
      "format_spec": null,
      "is_required": true,
      "source_section": "NSF 26-508 Section V.A",
      "structured_rule_type": null,
      "structured_rule_value": null
    },
    {
      "label": "Mentoring Plan",
      "code": "MENTORING_PLAN",
      "description": "Required only if the proposal requests funding for postdoctoral researchers or graduate students.",
      "page_limit": null,
      "format_spec": null,
      "is_required": true,
      "source_section": "PAPPG Chapter II.D.2",
      "structured_rule_type": "mentoring_plan_required_if",
      "structured_rule_value": "postdoc_or_grad_student_funded"
    },
    {
      "label": "Letter of Intent",
      "code": "LETTER_OF_INTENT",
      "description": "Required. One per institution via Research.gov. AOR submission not required. No Supplementary Documents permitted with the LOI.",
      "page_limit": null,
      "format_spec": null,
      "is_required": true,
      "source_section": "NSF 26-508 Section IV",
      "structured_rule_type": "loi_required",
      "structured_rule_value": "required"
    },
    {
      "label": "LOI Title",
      "code": "LOI_TITLE",
      "description": "Must begin with \"[Full name of state, DC, or territory] Coordination Hub\" followed by a descriptive project title; precise, informative language; no acronyms.",
      "page_limit": null,
      "format_spec": null,
      "is_required": true,
      "source_section": "NSF 26-508 Section IV",
      "structured_rule_type": null,
      "structured_rule_value": null
    },
    {
      "label": "LOI PI and Senior Personnel Section",
      "code": "LOI_PI_SENIOR_PERSONNEL",
      "description": "Full names for PI and all Co-PIs; institutional affiliations for PI, Co-PIs, and all Senior Personnel; all sub-awardee personnel included; PI as NSF point of contact with e-mail address.",
      "page_limit": null,
      "format_spec": null,
      "is_required": true,
      "source_section": "NSF 26-508 Section IV",
      "structured_rule_type": null,
      "structured_rule_value": null
    },
    {
      "label": "LOI Participating Organizations Section",
      "code": "LOI_PARTICIPATING_ORGANIZATIONS",
      "description": "All institutions involved in the project and all community partners listed.",
      "page_limit": null,
      "format_spec": null,
      "is_required": true,
      "source_section": "NSF 26-508 Section IV",
      "structured_rule_type": null,
      "structured_rule_value": null
    },
    {
      "label": "LOI Synopsis",
      "code": "LOI_SYNOPSIS",
      "description": "Describes the work in sufficient detail for reviewer selection. One-page limit.",
      "page_limit": 1,
      "format_spec": null,
      "is_required": true,
      "source_section": "NSF 26-508 Section IV",
      "structured_rule_type": null,
      "structured_rule_value": null
    },
    {
      "label": "Project Description Section 1 \u2014 Vision and Approach to Responsibilities",
      "code": "PD_SECTION_1_VISION_AND_APPROACH",
      "description": "Mandated section header must appear exactly as stated. Describes vision for advancing statewide AI readiness; addresses all five areas of responsibility (AI Learning and Resource Navigator; State/Territory AI Readiness Strategic Plan; AI Deployment Support; AI Readiness Training & Capacity Building; Coordination Within Priority Sectors); evidence of prior statewide/multi-sector experience; strategies for scaling and supporting local pilots.",
      "page_limit": null,
      "format_spec": null,
      "is_required": true,
      "source_section": "NSF 26-508 Section V",
      "structured_rule_type": null,
      "structured_rule_value": null
    },
    {
      "label": "Project Description Section 2 \u2014 Organizational Background, Team Expertise, and Partnership Rationale",
      "code": "PD_SECTION_2_ORG_TEAM_PARTNERSHIPS",
      "description": "Mandated section header must appear exactly as stated. Demonstrates lead organization's statewide convening power, operational capacity, and multi-sector initiative experience; team coordination across education, workforce, industry, and government; AI expertise; partner rationale; governance; Advisory Board (encouraged); identified partnership gaps with filling plans.",
      "page_limit": null,
      "format_spec": null,
      "is_required": true,
      "source_section": "NSF 26-508 Section V",
      "structured_rule_type": null,
      "structured_rule_value": null
    },
    {
      "label": "Project Description Section 3 \u2014 Current State of AI Planning and Coordination",
      "code": "PD_SECTION_3_CURRENT_STATE",
      "description": "Mandated section header must appear exactly as stated. Overview of existing AI readiness efforts in the state/territory; key stakeholders; what is working; gaps and unmet needs; how the Hub will build on existing efforts.",
      "page_limit": null,
      "format_spec": null,
      "is_required": true,
      "source_section": "NSF 26-508 Section V",
      "structured_rule_type": null,
      "structured_rule_value": null
    },
    {